<FrameGraph xmlns="http://arctisaurora/AuroraSystemsTypes"
        xmlns:xsi="http://www.w3.org/2001/XMLSchema-instance"
        xsi:schemaLocation="http://arctisaurora/AuroraSystemsTypes ../Schemas/SystemsTypeSchema.xsd">

	<Dedicated System="Render"/>

	<Step Action="Main.Input" Pinned="true" Writes="UIElements UIQuads Entities Gradients Effects Animations Paints Signals"/>
	<Step Action="Main.Logic" Pinned="true" Writes="UIElements UIQuads Entities Gradients Effects Animations Paints Signals AnimationDone"/>
	<Step Action="Animation.Step" Reads="Signals Keyframes" Writes="Animations Paints UIElements.ArrangeData UIElements.LayoutNode UIElements.VulkanControl LayoutDirty AnimationDone"/>
	<Step Action="Physics.Step" Writes="Entities.TransformData"/>
	<Step Edge="UIElements" Pinned="true"/>
	<Step Edge="LayoutDirty" Pinned="true"/>
	<Step Action="Main.Layout" Pinned="true" Writes="UIElements UIQuads Entities Gradients Effects Animations Paints LayoutDirty"/>

	<Step Edge="UIQuads" Pinned="true"/>
	<Step Edge="Entities" Pinned="true"/>
	<Step Edge="Gradients" Pinned="true"/>
	<Step Edge="Effects" Pinned="true"/>
	<Step Edge="Paints" Pinned="true"/>
	<Step Edge="Animations" Pinned="true"/>
	<Step Edge="AnimationDone" Pinned="true"/>

	<Step Action="Main.DrawLists" Pinned="true" Writes="UIElements UIQuads Entities Gradients Effects Animations Paints"/>

</FrameGraph>
